{
  "schema_version": "real-source-goldset-v1",
  "status": "inactive-template",
  "goldset_id": "retrieval-template",
  "domain": "PLACEHOLDER: scholarly domain and subfield",
  "task_type": "retrieval",
  "visible_prompt": "PLACEHOLDER: prompt that asks the skill to retrieve or identify core sources for a bounded question.",
  "allowed_tools": [
    "PLACEHOLDER: permitted search or library tools"
  ],
  "network_policy": "PLACEHOLDER: no-network, public-web-allowed, library-catalog-only, or another explicit policy",
  "gold_sources": [
    {
      "source_id": "gold-1",
      "title": "PLACEHOLDER: human-reviewed core source title",
      "authors": [
        "PLACEHOLDER: author or authoring body"
      ],
      "year": "PLACEHOLDER: publication year if known",
      "locator_or_access_note": "PLACEHOLDER: DOI, stable URL, catalog record, archive note, or access note",
      "role": "PLACEHOLDER: primary source, review, dataset, method paper, or other reviewed role"
    }
  ],
  "acceptable_sources": [
    {
      "source_id": "acceptable-1",
      "title": "PLACEHOLDER: human-reviewed acceptable adjacent source title",
      "authors": [
        "PLACEHOLDER: author or authoring body"
      ],
      "year": "PLACEHOLDER: publication year if known",
      "locator_or_access_note": "PLACEHOLDER: DOI, stable URL, catalog record, archive note, or access note",
      "role": "PLACEHOLDER: acceptable supporting or background role"
    }
  ],
  "decoy_sources": [
    {
      "source_id": "decoy-1",
      "title": "PLACEHOLDER: source title that looks relevant but should not satisfy the task",
      "authors": [
        "PLACEHOLDER: author or authoring body"
      ],
      "year": "PLACEHOLDER: publication year if known",
      "locator_or_access_note": "PLACEHOLDER: DOI, stable URL, catalog record, archive note, or access note",
      "role": "PLACEHOLDER: decoy role",
      "decoy_reason": "PLACEHOLDER: human-reviewed reason this source is a decoy, such as wrong population, wrong method, commentary only, outdated claim, or weak source type."
    }
  ],
  "disallowed_sources": [
    {
      "source_id": "disallowed-1",
      "title": "PLACEHOLDER: source title that must not be used",
      "authors": [
        "PLACEHOLDER: author or authoring body"
      ],
      "year": "PLACEHOLDER: publication year if known",
      "locator_or_access_note": "PLACEHOLDER: DOI, stable URL, catalog record, archive note, or access note",
      "role": "PLACEHOLDER: disallowed role"
    }
  ],
  "required_distinctions": [
    {
      "id": "source-type-distinction",
      "expectation": "PLACEHOLDER: distinction the skill must preserve, such as primary source versus review or commentary.",
      "evidence_basis": "PLACEHOLDER: human-reviewed source IDs and reason."
    }
  ],
  "must_support": [
    {
      "id": "retrieval-core-source",
      "expectation": "PLACEHOLDER: retrieval behavior that must be supported by reviewed sources.",
      "evidence_basis": "PLACEHOLDER: source IDs and reviewer basis."
    }
  ],
  "must_reject": [
    {
      "id": "retrieval-decoy-source",
      "expectation": "PLACEHOLDER: source, claim, or shortcut the skill must reject.",
      "evidence_basis": "PLACEHOLDER: source IDs and reviewer basis."
    }
  ],
  "must_remain_uncertain": [
    {
      "id": "retrieval-field-uncertainty",
      "expectation": "PLACEHOLDER: uncertainty the skill must not resolve without stronger source evidence.",
      "evidence_basis": "PLACEHOLDER: source IDs and reviewer basis."
    }
  ],
  "citation_audit_expectations": [
    {
      "id": "citation-metadata-check",
      "expectation": "PLACEHOLDER: citation metadata or locator check expected for retrieved sources.",
      "evidence_basis": "PLACEHOLDER: source IDs and reviewer basis."
    }
  ],
  "field_state_note": "PLACEHOLDER: human-reviewed note on the state of the field and known uncertainty.",
  "human_review_required": true,
  "reviewer_notes": "PLACEHOLDER: notes on who reviewed the source truth and what remains outside scope.",
  "last_reviewed_date": "PLACEHOLDER: YYYY-MM-DD after human review",
  "source_access_notes": "PLACEHOLDER: where reviewers can inspect the sources without storing source text here."
}
